{
  "protocol_version": "agent.v1",
  "proposal_id": "proposal_01975d8c-72f5-7f1e-9b7e-c7ef3e0a1000",
  "run_id": "run_01975d8c-72f5-7f1e-9b7e-c7ef3e0a1000",
  "agent_id": "execution_review",
  "kind": "fake",
  "summary": "Create a fake proposal for approval testing",
  "payload": {
    "value": 7
  },
  "risk": "medium",
  "approval_policy": "manual",
  "approval_required": true,
  "status": "pending_approval",
  "created_at": "2026-06-28T09:12:31Z",
  "expires_at": null
}
